{
  "$schema": "https://zenodo.org/records/22103522/files/program-matematika-indonesia-catalog-v1.schema.json",
  "schemaVersion": 1,
  "snapshotDate": "2026-08-26",
  "sourceCommit": "cdddd5535c01f599fe6d20e323c62dba6b3d55ae",
  "program": {
    "id": "program-matematika-indonesia",
    "title": "Program Matematika Indonesia — Peta Kurikulum Terbuka",
    "language": "id-ID",
    "version": "0.56.0",
    "snapshotDate": "2026-08-26",
    "totalCourseRoles": 40,
    "selectedCorpusRoles": 40,
    "unresolvedRoleIds": [],
    "completedPublicCourseRoleIds": [
      "A00",
      "B10",
      "B40",
      "B80",
      "B90",
      "C10",
      "C30",
      "C40",
      "C60",
      "C70",
      "C80",
      "C100",
      "C110",
      "C120",
      "C130",
      "D20",
      "D110"
    ],
    "completedPublicRecordDois": [
      "10.5281/zenodo.22070683",
      "10.5281/zenodo.22060439",
      "10.5281/zenodo.22070458",
      "10.5281/zenodo.22053905",
      "10.5281/zenodo.22062144",
      "10.5281/zenodo.22082567",
      "10.5281/zenodo.22062449",
      "10.5281/zenodo.22052196",
      "10.5281/zenodo.22062005",
      "10.5281/zenodo.21932787",
      "10.5281/zenodo.22054086",
      "10.5281/zenodo.22070943",
      "10.5281/zenodo.22070653",
      "10.5281/zenodo.22088947",
      "10.5281/zenodo.22062017",
      "10.5281/zenodo.22102628"
    ],
    "website": "https://kokunoyumeto.github.io/program-matematika-indonesia/",
    "zenodo": "https://doi.org/10.5281/zenodo.22103522",
    "zenodoConcept": "https://doi.org/10.5281/zenodo.22059707",
    "provenance": {
      "model": "OpenAI Codex gpt-5.6-sol, Ultra",
      "role": "Koordinasi, rekayasa backend, dan penerbitan snapshot pusat atas instruksi pengguna; kredit sumber dan kontributor tetap melekat pada setiap komponen."
    },
    "backend": {
      "schemaVersion": "1.0.0",
      "status": "validated",
      "centralRecordCount": 2122,
      "completeCorpusMigrations": [
        {
          "corpus": "Discrete Mathematics: An Open Introduction 4 — Bahasa Indonesia",
          "recordCount": 163583,
          "result": "lossless-zero-copy-pass"
        },
        {
          "corpus": "Hefferon — Linear Algebra, Bahasa Indonesia v2026.08.22",
          "recordCount": 22131,
          "result": "lossless-zero-copy-one-to-one-native-backend-adapter-pass"
        },
        {
          "corpus": "Komputasi Matematis dan Eksperimen yang Dapat Direproduksi — Bahasa Indonesia",
          "recordCount": 339,
          "result": "lossless-zero-copy-one-to-one-native-catalog-adapter-pass"
        },
        {
          "corpus": "Open Logic Project — OLP-0722, Bahasa Indonesia",
          "recordCount": 6522,
          "result": "deterministic-zero-copy-pass"
        },
        {
          "corpus": "Judson — Abstract Algebra: Theory and Applications, Bahasa Indonesia",
          "recordCount": 36978,
          "result": "additive-zero-copy-pass"
        },
        {
          "corpus": "Yet Another Introductory Number Theory Textbook, Bahasa Indonesia",
          "recordCount": 6967,
          "result": "lossless-additive-adapter-pass"
        },
        {
          "corpus": "Keller–Trotter — Applied Combinatorics, Bahasa Indonesia",
          "recordCount": 19049,
          "result": "lossless-additive-one-common-record-per-native-record-pass"
        },
        {
          "corpus": "Mathematics in Lean — Bahasa Indonesia v4.30.0-id.3",
          "recordCount": 10978,
          "result": "lossless-zero-copy-one-to-one-pass"
        },
        {
          "corpus": "OpenStax Prealgebra 2e — Bahasa Indonesia v0.2.7",
          "recordCount": 523046,
          "result": "lossless-streaming-zero-copy-adapter-pass"
        },
        {
          "corpus": "Lega v1.01 — Pemodelan Matematis, Bahasa Indonesia",
          "recordCount": 16029,
          "result": "lossless-replayable-zero-copy-adapter-pass"
        },
        {
          "corpus": "Open Optimization Book 1 + laboratorium Pyomo/HiGHS O018, Bahasa Indonesia",
          "recordCount": 25805,
          "result": "lossless-zero-copy-one-to-one-plus-segment-variant-projection-pass"
        },
        {
          "corpus": "Tea Time Numerical Analysis — Bahasa Indonesia v3.0-id.2-r1",
          "recordCount": 53055,
          "result": "additive-zero-copy-virtual-adapter-pass"
        },
        {
          "corpus": "Erdman — Functional Analysis and Operator Algebras, Bahasa Indonesia",
          "recordCount": 41689,
          "result": "lossless-zero-copy-virtual-adapter-pass"
        }
      ],
      "schema": "https://zenodo.org/records/22103522/files/interlanguage-math-backend-v1.schema.json?download=1",
      "sourceFormatProfile": "https://zenodo.org/records/22103522/files/interlanguage-source-format-profile-v1.schema.json?download=1",
      "package": "https://zenodo.org/records/22103522/files/program-matematika-indonesia-backend-v1-v0.56.0.zip?download=1",
      "federationV2": {
        "version": "0.3.0",
        "status": "validated",
        "recordCount": 2434,
        "datasetCount": 34,
        "courseCount": 40,
        "learnerSurfaceCount": 128,
        "webRouteCount": 41,
        "identityCrosswalkCount": 2122,
        "package": "https://zenodo.org/records/22103522/files/program-matematika-indonesia-backend-v2-v0.56.0.zip?download=1",
        "packageSchema": "https://zenodo.org/records/22103522/files/federation-package-v2.schema.json?download=1",
        "recordSchema": "https://zenodo.org/records/22103522/files/federation-record-v2.schema.json?download=1",
        "validationReceipt": "https://zenodo.org/records/22103522/files/GLOBAL_BACKEND_V2_PHASE1_VALIDATION_RECEIPT_v0.56.0.json?download=1"
      },
      "learnerReadModelV1": {
        "version": "1.0.0",
        "status": "validated",
        "courseCount": 40,
        "prerequisiteEdgeCount": 82,
        "authority": "https://zenodo.org/records/22103522/files/curriculum-authority-v1.json?download=1",
        "authoritySchema": "https://zenodo.org/records/22103522/files/curriculum-authority-v1.schema.json?download=1",
        "readModel": "https://zenodo.org/records/22103522/files/learner-read-model-v1.json?download=1",
        "readModelSchema": "https://zenodo.org/records/22103522/files/learner-read-model-v1.schema.json?download=1",
        "validationReceipt": "https://zenodo.org/records/22103522/files/LOCAL_RELEASE_VALIDATION_v0.56.0.json?download=1",
        "publicEndpoint": "https://kokunoyumeto.github.io/program-matematika-indonesia/data/learner-read-model.json"
      },
      "federationV21": {
        "version": "2.1.0",
        "status": "pilot_validated",
        "pilot_courses": [
          "A00",
          "B10",
          "D20"
        ],
        "pilot_units": 255,
        "pilot_relations": 1171,
        "route_wrapper_course": "D20",
        "packageSchema": "https://zenodo.org/records/22103522/files/federation-unit-package-v2.1.schema.json?download=1",
        "recordSchema": "https://zenodo.org/records/22103522/files/federation-unit-record-v2.1.schema.json?download=1",
        "package": "https://zenodo.org/records/22103522/files/program-matematika-indonesia-backend-v2.1-pilots-v0.56.0.zip?download=1"
      }
    },
    "repositories": {
      "github": {
        "url": "https://github.com/KokunoYumeto/program-matematika-indonesia",
        "status": "available",
        "lastConfirmedAt": "2026-08-26"
      }
    },
    "status": "in-progress"
  },
  "topics": [
    "Fondasi & Kalkulus",
    "Analisis",
    "Aljabar",
    "Geometri & Topologi",
    "Peluang & Statistika",
    "Diskrit & Logika",
    "Komputasi & Optimisasi",
    "Praktik Riset"
  ],
  "counts": {
    "courseRoles": 40,
    "selectedCorpusRoles": 40,
    "unresolvedRoles": 0,
    "completedPublicCourseRoles": 17,
    "completedPublicRecords": 16
  },
  "courses": [
    {
      "id": "A00",
      "ownerLane": "R001",
      "level": "A",
      "topic": "Fondasi & Kalkulus",
      "state": "published",
      "title": "Praaljabar dan Fondasi Kuantitatif",
      "prerequisites": [],
      "purpose": "Bilangan bulat, pecahan, desimal, persen, rasio, pengukuran, dan persamaan dasar dengan jalur diagnosis yang dapat dilewati.",
      "outcome": "Mengolah representasi numerik dengan andal dan mengenali apakah kesalahan berikutnya bersifat aritmetis atau konseptual.",
      "corpus": "OpenStax Prealgebra 2e — edisi Bahasa Indonesia lengkap",
      "note": "Selesai dan terverifikasi publik: 75/75 referensi sumber, pembaca PDF 3.016 halaman, reader HTML responsif, dan backend deterministik 519.678 rekaman. Item Figshare opsional tetap diblokir oleh akun layanan yang tidak aktif; Zenodo dan GitHub tidak terpengaruh.",
      "reader": "https://kokunoyumeto.github.io/openstax-prealgebra-2e-id-ID/",
      "edition": "https://zenodo.org/records/22070683/files/prealgebra-2e-id-ID-v0.2.7-reader.pdf?download=1",
      "repository": "https://github.com/KokunoYumeto/openstax-prealgebra-2e-id-ID",
      "zenodo": "https://doi.org/10.5281/zenodo.22070683"
    },
    {
      "id": "A10",
      "ownerLane": "OPENSTAX-ELEMENTARY",
      "level": "A",
      "topic": "Fondasi & Kalkulus",
      "state": "production",
      "title": "Aljabar Dasar",
      "prerequisites": [
        "A00"
      ],
      "purpose": "Persamaan dan pertidaksamaan linear, grafik, sistem, eksponen, polinom, faktorisasi, bentuk rasional, dan akar.",
      "outcome": "Menerjemahkan hubungan kuantitatif ke bentuk aljabar dan menyelesaikannya dengan langkah yang dapat dijelaskan.",
      "corpus": "OpenStax Elementary Algebra 2e — 82 modul",
      "note": "Korpus terpilih; produksi masih pada tahap awal."
    },
    {
      "id": "A20",
      "ownerLane": "OPENSTAX-INTERMEDIATE",
      "level": "A",
      "topic": "Fondasi & Kalkulus",
      "state": "production",
      "title": "Aljabar Menengah",
      "prerequisites": [
        "A10"
      ],